{
  "schema_version": "corpus-manifest-v1",
  "root_name": "sources",
  "corpus_checksum": "sha256:80170ea3cd3b1adb2b4ecc71918a9460a87050a6cfbcf22fa639611e8dded919",
  "source_count": 14,
  "parsed_source_count": 14,
  "failed_source_count": 0,
  "total_bytes": 23194,
  "total_chunks": 47,
  "total_extracted_chars": 19961,
  "empty_extraction_count": 0,
  "size_bucket_counts": {
    "medium": 1,
    "small": 13
  },
  "chunk_ids": [
    "doc_05b3ad190a200dd1ca01b3346f8efc5b3a2b57a23ac2924bd13373bc470b113c_chunk_d984fa9bb22c028d",
    "doc_0af459e6477287d2ded60cee0cb1bfbcc0854178e9a388c6d9de9bc1b6e58e14_chunk_4ea05b840e818135",
    "doc_0af459e6477287d2ded60cee0cb1bfbcc0854178e9a388c6d9de9bc1b6e58e14_chunk_8fc7f77557bfbfce",
    "doc_0af459e6477287d2ded60cee0cb1bfbcc0854178e9a388c6d9de9bc1b6e58e14_chunk_af85ef47c8c51d53",
    "doc_0af459e6477287d2ded60cee0cb1bfbcc0854178e9a388c6d9de9bc1b6e58e14_chunk_ff7563f2b8937fab",
    "doc_151caf2f0fcf575007d35c38d49d9363683f2f693e121855614d307091a66602_chunk_e50fd4fa02498603",
    "doc_1563952351ed7ea2b0c7f156b126db33af02f163af03e9d6293b9c7ff6945dfe_chunk_276106a73760d630",
    "doc_1563952351ed7ea2b0c7f156b126db33af02f163af03e9d6293b9c7ff6945dfe_chunk_6ebaf20e39b24d27",
    "doc_1563952351ed7ea2b0c7f156b126db33af02f163af03e9d6293b9c7ff6945dfe_chunk_b0559205e8597445",
    "doc_1563952351ed7ea2b0c7f156b126db33af02f163af03e9d6293b9c7ff6945dfe_chunk_c62fde0ca0db362d",
    "doc_1563952351ed7ea2b0c7f156b126db33af02f163af03e9d6293b9c7ff6945dfe_chunk_ccb93ab2d0d44bad",
    "doc_1563952351ed7ea2b0c7f156b126db33af02f163af03e9d6293b9c7ff6945dfe_chunk_e137a60cdc1db2cb",
    "doc_1563952351ed7ea2b0c7f156b126db33af02f163af03e9d6293b9c7ff6945dfe_chunk_f48ef38420b2543d",
    "doc_1563952351ed7ea2b0c7f156b126db33af02f163af03e9d6293b9c7ff6945dfe_chunk_fb14cc71e2c90e20",
    "doc_2ba543a242160e7b4bbaba2957f61565a2d3918c782d61626a10465a47faa3de_chunk_63e331234437e350",
    "doc_31b58726695d0ebc70418f125ad9e630d39f16fb8f5a0524d6002eca7958d433_chunk_c76ed2d16be26055",
    "doc_3b10aba9f96eb41259d0f5b67b4afe120c3ce132408a42c16b1b200ba9287742_chunk_64ad90918d0740c1",
    "doc_53ded4b74daf42219cfaf41c39e760d7d4470290bf6bae1b663aa1851dc9e76c_chunk_043e452274321b6a",
    "doc_53ded4b74daf42219cfaf41c39e760d7d4470290bf6bae1b663aa1851dc9e76c_chunk_21fbbb8f06c8c197",
    "doc_53ded4b74daf42219cfaf41c39e760d7d4470290bf6bae1b663aa1851dc9e76c_chunk_37d456d69a7ecd69",
    "doc_53ded4b74daf42219cfaf41c39e760d7d4470290bf6bae1b663aa1851dc9e76c_chunk_5dfa65091522122f",
    "doc_53ded4b74daf42219cfaf41c39e760d7d4470290bf6bae1b663aa1851dc9e76c_chunk_6b7e0aa44d0998d5",
    "doc_53ded4b74daf42219cfaf41c39e760d7d4470290bf6bae1b663aa1851dc9e76c_chunk_6d6fc30a5d171d18",
    "doc_53ded4b74daf42219cfaf41c39e760d7d4470290bf6bae1b663aa1851dc9e76c_chunk_741684e611f9f372",
    "doc_53ded4b74daf42219cfaf41c39e760d7d4470290bf6bae1b663aa1851dc9e76c_chunk_74c57ae12b8eddb8",
    "doc_53ded4b74daf42219cfaf41c39e760d7d4470290bf6bae1b663aa1851dc9e76c_chunk_79f2d2dd7528c38b",
    "doc_53ded4b74daf42219cfaf41c39e760d7d4470290bf6bae1b663aa1851dc9e76c_chunk_a3ce5ab546e66698",
    "doc_53ded4b74daf42219cfaf41c39e760d7d4470290bf6bae1b663aa1851dc9e76c_chunk_b09bac254f8d7809",
    "doc_53ded4b74daf42219cfaf41c39e760d7d4470290bf6bae1b663aa1851dc9e76c_chunk_e12037224cc965e5",
    "doc_53ded4b74daf42219cfaf41c39e760d7d4470290bf6bae1b663aa1851dc9e76c_chunk_ef0b8e131de05c7e",
    "doc_53ded4b74daf42219cfaf41c39e760d7d4470290bf6bae1b663aa1851dc9e76c_chunk_f7dab6602e925c67",
    "doc_6053141765e1150186d68cf89067d79875c8b725eadef9eb541d31ee0bad4a52_chunk_f105c5bd1a17a5e4",
    "doc_75c1cbf96e88ce7d946b678a426f5e163e66da6d179cec74201c88690727885f_chunk_017179d604e4218e",
    "doc_75c1cbf96e88ce7d946b678a426f5e163e66da6d179cec74201c88690727885f_chunk_069e8f04d9d872f8",
    "doc_75c1cbf96e88ce7d946b678a426f5e163e66da6d179cec74201c88690727885f_chunk_255b34ab59d3ad5d",
    "doc_75c1cbf96e88ce7d946b678a426f5e163e66da6d179cec74201c88690727885f_chunk_31cbe8b610fae902",
    "doc_75c1cbf96e88ce7d946b678a426f5e163e66da6d179cec74201c88690727885f_chunk_4922d38f3dc78591",
    "doc_75c1cbf96e88ce7d946b678a426f5e163e66da6d179cec74201c88690727885f_chunk_6935e12a985c44de",
    "doc_75c1cbf96e88ce7d946b678a426f5e163e66da6d179cec74201c88690727885f_chunk_6c70852ec418ded0",
    "doc_75c1cbf96e88ce7d946b678a426f5e163e66da6d179cec74201c88690727885f_chunk_83364d8dbd592026",
    "doc_75c1cbf96e88ce7d946b678a426f5e163e66da6d179cec74201c88690727885f_chunk_aa5144ce2a3d03a0",
    "doc_75c1cbf96e88ce7d946b678a426f5e163e66da6d179cec74201c88690727885f_chunk_bcbc850a334b4047",
    "doc_75c1cbf96e88ce7d946b678a426f5e163e66da6d179cec74201c88690727885f_chunk_c3ac59205b2601ee",
    "doc_810b99f226dc7713b030a08f58b067c9efeace71131ac0ac1d78bf82b04e65f7_chunk_9a5c1fcf06aa9b10",
    "doc_86201cfac4e8f8ba5a4ade86e5504ded2916cd31d8433d909e5abfd0be77b81d_chunk_ea3f6d08b1145f66",
    "doc_a085d26fe11dd76ae849d94429b405c18027a9023420ea4d9de69f39069dab62_chunk_b749262fca42d6f0",
    "doc_cc78d57887db73a67136d5f8928d69f14e67ee123caea8d16ae7f0d9f9d193a9_chunk_b580117083cbc106"
  ],
  "chunk_size_buckets": {
    "doc_05b3ad190a200dd1ca01b3346f8efc5b3a2b57a23ac2924bd13373bc470b113c_chunk_d984fa9bb22c028d": "small",
    "doc_0af459e6477287d2ded60cee0cb1bfbcc0854178e9a388c6d9de9bc1b6e58e14_chunk_4ea05b840e818135": "small",
    "doc_0af459e6477287d2ded60cee0cb1bfbcc0854178e9a388c6d9de9bc1b6e58e14_chunk_8fc7f77557bfbfce": "small",
    "doc_0af459e6477287d2ded60cee0cb1bfbcc0854178e9a388c6d9de9bc1b6e58e14_chunk_af85ef47c8c51d53": "small",
    "doc_0af459e6477287d2ded60cee0cb1bfbcc0854178e9a388c6d9de9bc1b6e58e14_chunk_ff7563f2b8937fab": "small",
    "doc_151caf2f0fcf575007d35c38d49d9363683f2f693e121855614d307091a66602_chunk_e50fd4fa02498603": "small",
    "doc_1563952351ed7ea2b0c7f156b126db33af02f163af03e9d6293b9c7ff6945dfe_chunk_276106a73760d630": "small",
    "doc_1563952351ed7ea2b0c7f156b126db33af02f163af03e9d6293b9c7ff6945dfe_chunk_6ebaf20e39b24d27": "small",
    "doc_1563952351ed7ea2b0c7f156b126db33af02f163af03e9d6293b9c7ff6945dfe_chunk_b0559205e8597445": "small",
    "doc_1563952351ed7ea2b0c7f156b126db33af02f163af03e9d6293b9c7ff6945dfe_chunk_c62fde0ca0db362d": "small",
    "doc_1563952351ed7ea2b0c7f156b126db33af02f163af03e9d6293b9c7ff6945dfe_chunk_ccb93ab2d0d44bad": "small",
    "doc_1563952351ed7ea2b0c7f156b126db33af02f163af03e9d6293b9c7ff6945dfe_chunk_e137a60cdc1db2cb": "small",
    "doc_1563952351ed7ea2b0c7f156b126db33af02f163af03e9d6293b9c7ff6945dfe_chunk_f48ef38420b2543d": "small",
    "doc_1563952351ed7ea2b0c7f156b126db33af02f163af03e9d6293b9c7ff6945dfe_chunk_fb14cc71e2c90e20": "small",
    "doc_2ba543a242160e7b4bbaba2957f61565a2d3918c782d61626a10465a47faa3de_chunk_63e331234437e350": "small",
    "doc_31b58726695d0ebc70418f125ad9e630d39f16fb8f5a0524d6002eca7958d433_chunk_c76ed2d16be26055": "small",
    "doc_3b10aba9f96eb41259d0f5b67b4afe120c3ce132408a42c16b1b200ba9287742_chunk_64ad90918d0740c1": "small",
    "doc_53ded4b74daf42219cfaf41c39e760d7d4470290bf6bae1b663aa1851dc9e76c_chunk_043e452274321b6a": "medium",
    "doc_53ded4b74daf42219cfaf41c39e760d7d4470290bf6bae1b663aa1851dc9e76c_chunk_21fbbb8f06c8c197": "medium",
    "doc_53ded4b74daf42219cfaf41c39e760d7d4470290bf6bae1b663aa1851dc9e76c_chunk_37d456d69a7ecd69": "medium",
    "doc_53ded4b74daf42219cfaf41c39e760d7d4470290bf6bae1b663aa1851dc9e76c_chunk_5dfa65091522122f": "medium",
    "doc_53ded4b74daf42219cfaf41c39e760d7d4470290bf6bae1b663aa1851dc9e76c_chunk_6b7e0aa44d0998d5": "medium",
    "doc_53ded4b74daf42219cfaf41c39e760d7d4470290bf6bae1b663aa1851dc9e76c_chunk_6d6fc30a5d171d18": "medium",
    "doc_53ded4b74daf42219cfaf41c39e760d7d4470290bf6bae1b663aa1851dc9e76c_chunk_741684e611f9f372": "medium",
    "doc_53ded4b74daf42219cfaf41c39e760d7d4470290bf6bae1b663aa1851dc9e76c_chunk_74c57ae12b8eddb8": "medium",
    "doc_53ded4b74daf42219cfaf41c39e760d7d4470290bf6bae1b663aa1851dc9e76c_chunk_79f2d2dd7528c38b": "medium",
    "doc_53ded4b74daf42219cfaf41c39e760d7d4470290bf6bae1b663aa1851dc9e76c_chunk_a3ce5ab546e66698": "medium",
    "doc_53ded4b74daf42219cfaf41c39e760d7d4470290bf6bae1b663aa1851dc9e76c_chunk_b09bac254f8d7809": "medium",
    "doc_53ded4b74daf42219cfaf41c39e760d7d4470290bf6bae1b663aa1851dc9e76c_chunk_e12037224cc965e5": "medium",
    "doc_53ded4b74daf42219cfaf41c39e760d7d4470290bf6bae1b663aa1851dc9e76c_chunk_ef0b8e131de05c7e": "medium",
    "doc_53ded4b74daf42219cfaf41c39e760d7d4470290bf6bae1b663aa1851dc9e76c_chunk_f7dab6602e925c67": "medium",
    "doc_6053141765e1150186d68cf89067d79875c8b725eadef9eb541d31ee0bad4a52_chunk_f105c5bd1a17a5e4": "small",
    "doc_75c1cbf96e88ce7d946b678a426f5e163e66da6d179cec74201c88690727885f_chunk_017179d604e4218e": "small",
    "doc_75c1cbf96e88ce7d946b678a426f5e163e66da6d179cec74201c88690727885f_chunk_069e8f04d9d872f8": "small",
    "doc_75c1cbf96e88ce7d946b678a426f5e163e66da6d179cec74201c88690727885f_chunk_255b34ab59d3ad5d": "small",
    "doc_75c1cbf96e88ce7d946b678a426f5e163e66da6d179cec74201c88690727885f_chunk_31cbe8b610fae902": "small",
    "doc_75c1cbf96e88ce7d946b678a426f5e163e66da6d179cec74201c88690727885f_chunk_4922d38f3dc78591": "small",
    "doc_75c1cbf96e88ce7d946b678a426f5e163e66da6d179cec74201c88690727885f_chunk_6935e12a985c44de": "small",
    "doc_75c1cbf96e88ce7d946b678a426f5e163e66da6d179cec74201c88690727885f_chunk_6c70852ec418ded0": "small",
    "doc_75c1cbf96e88ce7d946b678a426f5e163e66da6d179cec74201c88690727885f_chunk_83364d8dbd592026": "small",
    "doc_75c1cbf96e88ce7d946b678a426f5e163e66da6d179cec74201c88690727885f_chunk_aa5144ce2a3d03a0": "small",
    "doc_75c1cbf96e88ce7d946b678a426f5e163e66da6d179cec74201c88690727885f_chunk_bcbc850a334b4047": "small",
    "doc_75c1cbf96e88ce7d946b678a426f5e163e66da6d179cec74201c88690727885f_chunk_c3ac59205b2601ee": "small",
    "doc_810b99f226dc7713b030a08f58b067c9efeace71131ac0ac1d78bf82b04e65f7_chunk_9a5c1fcf06aa9b10": "small",
    "doc_86201cfac4e8f8ba5a4ade86e5504ded2916cd31d8433d909e5abfd0be77b81d_chunk_ea3f6d08b1145f66": "small",